{
  "schema_version": "1.0",
  "seed_id": "cwe122_plan_001",
  "seed": 1,
  "cwe_id": "CWE-122",
  "vulnerability_class": "Heap-based Buffer Overflow",
  "mutation_strategy": "alloc_size_undercount",
  "target_pattern": {
    "pattern_type": "malloc_call",
    "min_candidate_score": 0.0
  },
  "source_constraints": {
    "max_targets": 1
  },
  "metadata": {
    "tags": [
      "auto-synthesised",
      "alloc_size_undercount",
      "cwe-122"
    ],
    "notes": "Auto-synthesised by insert-me plan-corpus. Target: counter.c:18 (score=0.55) | source: C:\\Users\\User\\insert_me\\examples\\local_targets\\minimal\\src"
  }
}