{
  "schema_version": "1.0",
  "seed_id": "cwe416-use-after-free-premature-free-001",
  "seed": 137,
  "cwe_id": "CWE-416",
  "vulnerability_class": "Use After Free",
  "description": "Insert a use-after-free by introducing a free() call on a pointer before its last dereference within the same function scope. The mutation inserts the free() immediately before a dereference site, leaving the subsequent access as a use of freed memory.",
  "mutation_strategy": "insert_premature_free",
  "target_pattern": {
    "pattern_type": "pointer_deref",
    "require_function_scope": true,
    "min_candidate_score": 0.6,
    "constraints": {
      "require_prior_malloc_in_scope": true,
      "min_deref_distance_from_alloc": 3,
      "require_no_existing_free_between": true
    }
  },
  "source_constraints": {
    "file_patterns": ["*.c", "*.cpp"],
    "exclude_patterns": ["*test*", "*_test.*", "*mock*", "*stub*"],
    "max_targets": 1
  },
  "metadata": {
    "tags": ["heap", "memory-corruption", "use-after-free", "temporal"],
    "difficulty": "medium",
    "references": ["https://cwe.mitre.org/data/definitions/416.html"],
    "notes": "Temporal safety violation. Harder to detect statically than off-by-one overflows because the free and use may appear syntactically far apart. Good stress test for inter-procedural analysis and taint tracking tools."
  }
}
