{
  "schema_version": "1.0",
  "seed_id": "cwe122-target-b-003",
  "seed": 117,
  "cwe_id": "CWE-122",
  "vulnerability_class": "Heap Buffer Overflow",
  "description": "Mutate a malloc() call in target-b source (dynarray.c, bstree.c, or strmap.c) to omit a header or metadata size component from the allocation, resulting in a buffer too small for the full structure and an overflow on field writes.",
  "mutation_strategy": "alloc_size_undercount",
  "target_pattern": {
    "pattern_type": "malloc_call",
    "require_function_scope": true,
    "min_candidate_score": 0.4,
    "constraints": {}
  },
  "source_constraints": {
    "file_patterns": [
      "*.c",
      "*.cpp"
    ],
    "exclude_patterns": [
      "*test*",
      "*_test.*",
      "*mock*",
      "*stub*"
    ],
    "max_targets": 1
  },
  "metadata": {
    "tags": [
      "heap",
      "buffer-overflow",
      "size-error",
      "target-b"
    ],
    "difficulty": "medium",
    "notes": "Targets malloc() call sites in dynarray.c, bstree.c, and strmap.c \u2014 reduces the allocation size argument to produce a heap buffer overflow on subsequent writes.",
    "references": [
      "https://cwe.mitre.org/data/definitions/122.html"
    ]
  }
}