{
  "schema_version": "1.0",
  "seed_id": "cwe415-target-b-002",
  "seed": 122,
  "cwe_id": "CWE-415",
  "vulnerability_class": "Double Free",
  "description": "Insert a double-free in target-b source (dynarray.c, bstree.c, or strmap.c) by repeating a free() on a data structure node pointer within a remove or destroy operation, creating a temporal heap corruption.",
  "mutation_strategy": "insert_double_free",
  "target_pattern": {
    "pattern_type": "free_call",
    "require_function_scope": true,
    "min_candidate_score": 0.4,
    "constraints": {}
  },
  "source_constraints": {
    "file_patterns": ["*.c", "*.cpp"],
    "exclude_patterns": ["*test*", "*_test.*", "*mock*", "*stub*"],
    "max_targets": 1
  },
  "metadata": {
    "tags": ["heap", "double-free", "temporal", "target-b"],
    "difficulty": "medium",
    "notes": "Targets free() call sites in dynarray.c, bstree.c, and strmap.c — injects a duplicate free() after the original to produce a double-free condition.",
    "references": ["https://cwe.mitre.org/data/definitions/415.html"]
  }
}
