{
  "schema_version": "1.0",
  "seed_id": "cwe401-target-b-001",
  "seed": 131,
  "cwe_id": "CWE-401",
  "vulnerability_class": "Memory Leak",
  "description": "Remove a free() call in target-b source (dynarray.c, bstree.c, or strmap.c) to introduce a memory leak, leaving a heap-allocated node or buffer unreleased after it is removed from the data structure.",
  "mutation_strategy": "remove_free_call",
  "target_pattern": {
    "pattern_type": "free_call",
    "require_function_scope": true,
    "min_candidate_score": 0.4,
    "constraints": {}
  },
  "source_constraints": {
    "file_patterns": [
      "*.c",
      "*.cpp"
    ],
    "exclude_patterns": [
      "*test*",
      "*_test.*",
      "*mock*",
      "*stub*"
    ],
    "max_targets": 1
  },
  "metadata": {
    "tags": [
      "heap",
      "memory-leak",
      "resource",
      "target-b"
    ],
    "difficulty": "easy",
    "notes": "Targets free() call sites in dynarray.c, bstree.c, and strmap.c \u2014 removes a deallocation to leave heap memory unreleased.",
    "references": [
      "https://cwe.mitre.org/data/definitions/401.html"
    ]
  }
}